ID;customer_customerId;author;note;createdAt
c1000000-0001-4000-8000-000000000001;ALFKI;Erika M.;Prefers email over phone. Needs quarterly reports by the 5th.;2025-02-01T10:15:00Z
c1000000-0001-4000-8000-000000000002;ALFKI;Jonas B.;Open to trialing our premium SKU in Q2.;2025-02-04T09:30:00Z
c1000000-0001-4000-8000-000000000003;ANATR;Pilar C.;Contract renewal discussion scheduled for March.;2025-02-02T14:00:00Z
c1000000-0001-4000-8000-000000000004;ANTON;Luis G.;Requested Spanish-language product sheets.;2025-02-03T11:45:00Z
c1000000-0001-4000-8000-000000000005;AROUT;Tom H.;Churn risk flagged by accounts. Needs executive touch.;2025-02-05T08:20:00Z
c1000000-0001-4000-8000-000000000006;BERGS;Erika M.;Key account. Always requires signed-for delivery.;2025-02-06T16:00:00Z
c1000000-0001-4000-8000-000000000007;BLAUS;Markus W.;Payment slightly delayed on last 2 invoices. Watch.;2025-02-07T13:10:00Z
c1000000-0001-4000-8000-000000000008;BLONP;Sophie L.;Great relationship with purchasing lead. Seasonal orders only.;2025-02-08T10:00:00Z
